{
  "$schema": "https://json-schema.org/draft/2020-12/schema",
  "$id": "https://alpha-research-lab.local/schemas/run_manifest_v2.json",
  "title": "RunManifest v2",
  "description": "Cross-stage run manifest linking a RunContext to its stage output artifacts. Schema version 2.",
  "type": "object",
  "required": ["schema_version", "run", "artifacts"],
  "additionalProperties": false,
  "properties": {
    "schema_version": {
      "type": "integer",
      "const": 2,
      "description": "Manifest schema version. Bump whenever the contract changes."
    },
    "run": {
      "$ref": "#/$defs/run_context",
      "description": "Identity and timing metadata for this pipeline run."
    },
    "artifacts": {
      "type": "object",
      "additionalProperties": {
        "type": "string",
        "minLength": 1
      },
      "description": "Logical artifact key to filesystem path. Stage-specific identifiers are stored here rather than as top-level fields."
    },
    "parent_run_id": {
      "oneOf": [
        {
          "type": "string",
          "minLength": 1
        },
        {
          "type": "null"
        }
      ],
      "default": null,
      "description": "run_id of the upstream run this run is derived from."
    }
  },
  "$defs": {
    "run_context": {
      "title": "RunContext",
      "description": "Immutable run-level identity and timing metadata shared by all pipeline stages.",
      "type": "object",
      "required": ["run_id", "run_type", "config_hash", "started_at_utc"],
      "additionalProperties": false,
      "properties": {
        "run_id": {
          "type": "string",
          "minLength": 1,
          "description": "Unique run identifier (UUID hex)."
        },
        "run_type": {
          "type": "string",
          "enum": [
            "ingestion",
            "dataset_build",
            "feature_build",
            "backtest",
            "evaluate",
            "report",
            "optimize",
            "live"
          ],
          "description": "Pipeline stage that produced this run."
        },
        "config_hash": {
          "type": "string",
          "minLength": 1,
          "description": "SHA-256 hex digest of the serialized config payload used for this run."
        },
        "session_id": {
          "oneOf": [
            {
              "type": "string",
              "minLength": 1
            },
            {
              "type": "null"
            }
          ],
          "default": null,
          "description": "Optional research session identifier grouping related runs."
        },
        "git_commit": {
          "oneOf": [
            {
              "type": "string",
              "minLength": 1
            },
            {
              "type": "null"
            }
          ],
          "description": "Short Git commit hash at the time of the run, or null when unavailable."
        },
        "started_at_utc": {
          "type": "string",
          "format": "date-time",
          "description": "UTC ISO-8601 timestamp when the run was created."
        },
        "completed_at_utc": {
          "oneOf": [
            {
              "type": "string",
              "format": "date-time"
            },
            {
              "type": "null"
            }
          ],
          "description": "UTC ISO-8601 timestamp when the run completed, or null if still in progress."
        }
      }
    }
  }
}
