{
  "schema_version": 2,
  "run": {
    "run_id": "regression_fixture_run_001",
    "run_type": "backtest",
    "config_hash": "a665a45920422f9d417e4867efdc4fb8a04a1f3fff1fa07e998e86f7f7a27ae3",
    "session_id": "regression_session_001",
    "git_commit": "abc1234",
    "started_at_utc": "2026-01-01T00:00:00Z",
    "completed_at_utc": "2026-01-01T00:05:00Z"
  },
  "artifacts": {
    "features": "data/runs/regression_fixture_run_001/stage_outputs/features.parquet",
    "metrics": "data/runs/regression_fixture_run_001/stage_outputs/metrics.json"
  },
  "parent_run_id": null
}
